{
  "service": {
    "name": "I-Ching",
    "description": "I-Ching Oracle service for hexagram evolution and symbolic entropy dynamics consultation",
    "version": "1.0.0",
    "baseUrl": "/v1/iching",
    "tags": ["divination", "symbolic-systems", "entropy-dynamics", "wisdom-oracle"]
  },
  "authentication": {
    "required": true,
    "methods": ["ApiKeyAuth", "BearerAuth"]
  },
  "endpoints": [
    {
      "path": "/evolve",
      "method": "POST",
      "summary": "Evolve I-Ching hexagram sequence",
      "description": "Generate hexagram evolution sequence using symbolic entropy dynamics for oracle consultation",
      "operationId": "evolveHexagrams",
      "requestBody": {
        "required": true,
        "contentType": "application/json",
        "schema": {
          "$ref": "#/types/IChingRequest"
        },
        "example": {
          "question": "What direction should I take in my career?",
          "context": "career",
          "querent": "seeker",
          "steps": 7,
          "config": {
            "oracle_mode": "quantum",
            "divination_method": "quantum_collapse",
            "wisdom_accumulation": true,
            "pattern_recognition": true,
            "cosmic_alignment": true,
            "temporal_prediction": false,
            "max_readings_per_session": 3,
            "reading_validity_hours": 24,
            "evolution_steps": 10,
            "resonance_threshold": 0.7,
            "certainty_threshold": 0.8,
            "timeout_seconds": 60
          }
        }
      },
      "responses": {
        "200": {
          "description": "Successful hexagram evolution",
          "schema": {
            "$ref": "#/types/IChingResponse"
          },
          "example": {
            "data": {
              "question": "What direction should I take in my career?",
              "context": "career",
              "querent": "seeker",
              "result": {
                "primary_hexagram": {
                  "number": 1,
                  "name": "The Creative",
                  "meaning": {
                    "core_meaning": "Creative force and initiation"
                  },
                  "lines": [
                    {"is_yang": true, "is_changing": false},
                    {"is_yang": true, "is_changing": false},
                    {"is_yang": true, "is_changing": false},
                    {"is_yang": true, "is_changing": false},
                    {"is_yang": true, "is_changing": false},
                    {"is_yang": true, "is_changing": false}
                  ],
                  "trigrams": [
                    {
                      "name": "Heaven",
                      "element": "Metal",
                      "attribute": "Creative",
                      "lines": [
                        {"is_yang": true, "is_changing": false},
                        {"is_yang": true, "is_changing": false},
                        {"is_yang": true, "is_changing": false}
                      ]
                    },
                    {
                      "name": "Heaven", 
                      "element": "Metal",
                      "attribute": "Creative",
                      "lines": [
                        {"is_yang": true, "is_changing": false},
                        {"is_yang": true, "is_changing": false},
                        {"is_yang": true, "is_changing": false}
                      ]
                    }
                  ]
                },
                "certainty": 0.85,
                "cosmic_alignment": 0.78,
                "interpretation": {
                  "situation": "A time of creative potential and new beginnings",
                  "guidance": "Trust your creative instincts and take initiative",
                  "action": "Move forward with confidence",
                  "context": "Career advancement through innovation",
                  "confidence": 0.82
                }
              },
              "sequence": [
                {
                  "step": 0,
                  "hexagram": "111111",
                  "binary": "111111",
                  "name": "The Creative",
                  "entropy": 1.2,
                  "attractorProximity": 0.0,
                  "timestamp": "2024-01-15T10:30:00Z"
                },
                {
                  "step": 6,
                  "hexagram": "111111",
                  "binary": "111111", 
                  "name": "The Creative",
                  "entropy": 0.1,
                  "attractorProximity": 0.87,
                  "timestamp": "2024-01-15T10:30:06Z"
                }
              ],
              "final_hexagram": {
                "pattern": "111111",
                "binary": "111111",
                "number": 1,
                "name": "The Creative",
                "description": "The Creative principle represents the fundamental force of creation and initiation.",
                "lines": [
                  "Nine at position 1: Hidden dragon. Do not act.",
                  "Nine at position 2: Dragon appearing in the field.",
                  "Nine at position 3: All day long the superior man is creatively active.",
                  "Nine at position 4: Wavering flight over the depths.",
                  "Nine at position 5: Flying dragon in the heavens.",
                  "Nine at position 6: Arrogant dragon will have cause to repent."
                ],
                "trigrams": {
                  "upper": {
                    "pattern": "111",
                    "name": "Heaven",
                    "element": "Metal",
                    "quality": "Creative"
                  },
                  "lower": {
                    "pattern": "111", 
                    "name": "Heaven",
                    "element": "Metal",
                    "quality": "Creative"
                  }
                }
              },
              "interpretation": {
                "summary": "The evolution sequence suggests a period of creative transformation.",
                "guidance": "Trust in the natural process of development.",
                "themes": ["transformation", "patience", "natural timing", "creative force"],
                "symbolism": {
                  "dragon": "creative potential ascending through stages",
                  "heaven": "pure creative principle and inspiration"
                },
                "context": {
                  "question_entropy": 0.85,
                  "symbolic_resonance": 0.74,
                  "attractor_alignment": 0.87
                },
                "confidence": 0.82
              },
              "stabilized": true,
              "metrics": {
                "finalEntropy": 0.1,
                "convergenceRate": 0.85,
                "stabilizationPoint": 6,
                "attractorStrength": 0.78,
                "symbolicResonance": 0.85
              },
              "timing": {
                "start_time": "2024-01-15T10:30:00Z",
                "end_time": "2024-01-15T10:30:00.150Z",
                "duration_ms": 150.0,
                "iterations": 7
              }
            },
            "status": 200,
            "request_id": "iching_evo_12345"
          }
        },
        "400": {
          "description": "Invalid request or missing question",
          "schema": {
            "$ref": "#/types/APIError"
          }
        },
        "500": {
          "description": "Oracle consultation failed",
          "schema": {
            "$ref": "#/types/APIError"
          }
        }
      },
      "errorCodes": [
        {
          "code": "ICHING_001",
          "message": "Invalid request format",
          "description": "JSON binding failed or malformed request body"
        },
        {
          "code": "ICHING_002",
          "message": "Question required",
          "description": "A question is required for I-Ching consultation"
        },
        {
          "code": "ICHING_003",
          "message": "Oracle consultation failed",
          "description": "Engine encountered an error during consultation"
        }
      ]
    },
    {
      "path": "/hexagrams",
      "method": "GET",
      "summary": "Get hexagram database",
      "description": "Get information about the complete I-Ching hexagram database including statistics",
      "operationId": "getHexagramDatabase",
      "responses": {
        "200": {
          "description": "Hexagram database information",
          "schema": {
            "$ref": "#/types/HexagramDatabase"
          },
          "example": {
            "data": {
              "total_hexagrams": 64,
              "total_trigrams": 8,
              "version": "King Wen sequence",
              "categories": [
                "Creative Principle", "Natural Law", "Difficulty", "Youthful Folly",
                "Waiting", "Conflict", "The Army", "Holding Together"
              ],
              "recent_consultations": 1247,
              "most_frequent": [
                {"number": 1, "name": "The Creative", "frequency": 12},
                {"number": 2, "name": "The Receptive", "frequency": 11},
                {"number": 11, "name": "Peace", "frequency": 9}
              ]
            },
            "status": 200,
            "request_id": "iching_db_67890"
          }
        }
      }
    },
    {
      "path": "/hexagrams/{number}",
      "method": "GET",
      "summary": "Get specific hexagram",
      "description": "Get detailed information about a specific hexagram by number (1-64)",
      "operationId": "getHexagram",
      "parameters": [
        {
          "name": "number",
          "in": "path",
          "required": true,
          "type": "integer",
          "description": "Hexagram number (1-64)",
          "minimum": 1,
          "maximum": 64,
          "example": 1
        }
      ],
      "responses": {
        "200": {